{
  "$schema": "https://json-schema.org/draft/2020-12/schema",
  "$id": "https://knowledge-atoms.com/schemas/atom-v1.json",
  "title": "knowledge-atoms v1 atom",
  "description": "A single atom in the knowledge-atoms catalog. Discriminated by `type`. knowledge-atoms holds the primitives for RAG, semantic memory, and AI knowledge graphs — entity types, relationship types, provenance records, fact types, and confidence primitives.",
  "type": "object",
  "required": ["schema", "type", "id", "version", "name"],
  "additionalProperties": false,
  "properties": {
    "schema": {
      "type": "string",
      "const": "https://knowledge-atoms.com/schemas/atom-v1.json"
    },
    "type": {
      "type": "string",
      "enum": ["entity-type", "relationship-type", "provenance-atom", "fact-type", "confidence-primitive"]
    },
    "id": {
      "type": "string",
      "pattern": "^[a-z0-9][a-z0-9-]{1,62}[a-z0-9]$"
    },
    "version": {
      "type": "string",
      "pattern": "^[0-9]+\\.[0-9]+\\.[0-9]+(?:-[A-Za-z0-9.-]+)?$"
    },
    "name": { "type": "string", "minLength": 1, "maxLength": 120 },
    "description": { "type": "string", "maxLength": 1000 },
    "content": {
      "type": "object",
      "description": "Type-specific payload. Shape depends on `type`.",
      "additionalProperties": true
    },
    "confidence": {
      "type": "number",
      "minimum": 0.0,
      "maximum": 1.0,
      "description": "Confidence score for the claim or fact encoded in this atom. 1.0 = certain; 0.0 = pure speculation."
    },
    "source_ref": {
      "type": "string",
      "description": "Reference to the authoritative source for this atom. May be a URL, a knowledge-atoms URI (knowledge-atoms://atoms/...), or a free-form citation."
    },
    "tags": {
      "type": "array",
      "items": { "type": "string", "minLength": 1, "maxLength": 60 },
      "uniqueItems": true
    }
  }
}
